{
  "$schema": "https://json-schema.org/draft/2020-12/schema",
  "$id": "https://lesser.host/spec/v3/schemas/soul-comm-send.request.schema.json",
  "title": "POST /api/v1/soul/comm/send request",
  "description": "Sends a new outbound comm. Host always generates the outgoing messageId/messageRef; callers must not supply outgoing message identity. The optional inReplyTo field is only a reply/conversation boundary reference for legacy send callers and must match prior host/provider conversation state for every recipient. Canonical mailbox replies should use POST /api/v1/soul/comm/mailbox/{agentId}/messages/{messageRef}/reply instead.",
  "type": "object",
  "additionalProperties": false,
  "required": ["channel", "agentId", "to", "body"],
  "properties": {
    "channel": { "type": "string", "enum": ["email", "sms", "voice"] },
    "agentId": { "type": "string", "pattern": "^0x[0-9a-fA-F]{64}$" },
    "to": { "type": "string", "minLength": 3, "maxLength": 512 },
    "cc": {
      "type": "array",
      "items": { "type": "string", "format": "email" }
    },
    "bcc": {
      "type": "array",
      "items": { "type": "string", "format": "email" }
    },
    "replyTo": { "type": "string", "format": "email" },
    "subject": { "type": "string", "minLength": 1, "maxLength": 998 },
    "body": { "type": "string", "minLength": 1 },
    "inReplyTo": {
      "type": ["string", "null"],
      "minLength": 1,
      "maxLength": 128,
      "description": "Optional reply/conversation boundary reference, not an outgoing message identity. If present, it must match a prior conversation with every recipient; invalid refs fail closed with 403 comm.boundary_violation and error.details.field=inReplyTo. Prefer the canonical mailbox reply endpoint for replies."
    },
    "idempotencyKey": { "type": "string", "minLength": 1, "maxLength": 256 },
    "actedBy": {
      "type": "string",
      "pattern": "^[a-z0-9_-]{1,30}$",
      "maxLength": 30,
      "description": "Optional pure caller attribution: the local lesser account username of the real human who initiated the send when the caller acts under a share grant rather than as the agent owner. Attribution only, never authorization: the instance key + agentId remain the sole authz input, host never resolves actedBy against host-side identity, and it never overrides the authenticated instance/agent context. Absent = owner/principal send. Malformed values fail closed with 400 comm.invalid_request and error.details.field=actedBy. actedBy participates in idempotency-key semantics like other payload fields."
    }
  },
  "allOf": [
    {
      "if": { "properties": { "channel": { "const": "email" } } },
      "then": {
        "required": ["subject"],
        "properties": { "to": { "type": "string", "format": "email" } }
      }
    },
    {
      "if": { "properties": { "channel": { "const": "sms" } } },
      "then": {
        "properties": { "to": { "type": "string", "pattern": "^\\+[1-9]\\d{1,14}$" } }
      }
    },
    {
      "if": { "properties": { "channel": { "const": "voice" } } },
      "then": {
        "properties": { "to": { "type": "string", "pattern": "^\\+[1-9]\\d{1,14}$" } }
      }
    }
  ]
}
